{
  "schema_version": "publish-receipt.v1",
  "receipt_id": "rcp-demo-001",
  "publication_id": "pub-demo-001",
  "idempotency_key": "demo-channel:pub-demo-001:v1",
  "target_channel": "demo-channel",
  "platform_post_id": "post-demo-001",
  "platform_post_url": "https://example.com/posts/post-demo-001",
  "published_at": "2026-09-11T04:05:00Z",
  "read_back_at": "2026-09-11T04:05:10Z",
  "status": "published",
  "error_code": null,
  "error_message": null
}
